dbn,school_name,internal_school_id,num_test_takers,reading_score,math_score,writing_score,pct_students_tested,academic_tier_rating
21K410,ABRAHAM LINCOLN HIGH SCHOOL,846740,475.0,396.0,437.0,393.0,78.0,2.0
21K525,EDWARD R. MURROW HIGH SCHOOL,258009,727.0,468.0,496.0,467.0,85.0,1.0
21K540,JOHN DEWEY HIGH SCHOOL,475475,448.0,404.0,468.0,390.0,92.0,3.0
21K559,LIFE ACADEMY HIGH SCHOOL FOR FILM AND MUSIC,274893,40.0,384.0,375.0,365.0,92.0,2.0
21K572,EXPEDITIONARY LEARNING SCHOOL FOR COMMUNITY LEADERS,185479,40.0,353.0,370.0,356.0,78.0,1.0
21K620,WILLIAM E. GRADY CAREER AND TECHNICAL EDUCATION HIGH SCHOOL,192849,95.0,394.0,414.0,376.0,,1.0
21K690,BROOKLYN STUDIO SECONDARY SCHOOL,704701,119.0,429.0,449.0,435.0,85.0,2.0
21K728,LIBERATION DIPLOMA PLUS,502505,10.0,411.0,369.0,373.0,85.0,
22K405,MIDWOOD HIGH SCHOOL,332013,824.0,478.0,519.0,476.0,,
22K425,JAMES MADISON HIGH SCHOOL,327087,518.0,436.0,475.0,439.0,92.0,1.0
22K495,SHEEPSHEAD BAY HIGH SCHOOL,275480,236.0,383.0,392.0,370.0,,
22K535,LEON M. GOLDSTEIN HIGH SCHOOL FOR THE SCIENCES,667336,259.0,524.0,561.0,542.0,92.0,2.0
22K555,BROOKLYN COLLEGE ACADEMY,477867,131.0,456.0,456.0,440.0,78.0,4.0
23K493,BROOKLYN COLLEGIATE: A COLLEGE BOARD SCHOOL,638267,60.0,389.0,409.0,387.0,85.0,2.0
23K514,FREDERICK DOUGLASS ACADEMY VII HIGH SCHOOL,735951,55.0,361.0,371.0,359.0,85.0,3.0
23K643,BROOKLYN DEMOCRACY ACADEMY,452120,11.0,349.0,338.0,331.0,78.0,2.0
23K646,ASPIRATIONS DIPLOMA PLUS HIGH SCHOOL,160203,7.0,311.0,371.0,311.0,78.0,4.0
23K647,METROPOLITAN DIPLOMA PLUS HIGH SCHOOL,719582,17.0,350.0,346.0,332.0,78.0,
23K697,TEACHERS PREPARATORY HIGH SCHOOL,296255,69.0,392.0,416.0,388.0,92.0,1.0
24Q264,ACADEMY OF FINANCE AND ENTERPRISE,654836,89.0,405.0,454.0,421.0,85.0,
24Q267,HIGH SCHOOL OF APPLIED COMMUNICATION,554115,39.0,406.0,413.0,400.0,85.0,1.0
24Q293,CIVIC LEADERSHIP ACADEMY,596521,69.0,404.0,429.0,407.0,85.0,4.0
24Q296,PAN AMERICAN INTERNATIONAL HIGH SCHOOL,378878,55.0,317.0,323.0,311.0,78.0,1.0
24Q299,BARD HIGH SCHOOL EARLY COLLEGE II,362876,155.0,545.0,568.0,550.0,78.0,
24Q455,NEWTOWN HIGH SCHOOL,344317,320.0,383.0,440.0,380.0,92.0,4.0
24Q485,GROVER CLEVELAND HIGH SCHOOL,900889,241.0,395.0,420.0,396.0,78.0,2.0
24Q520,MIDDLE COLLEGE HIGH SCHOOL AT LAGUARDIA COMMUNITY COLLEGE,902216,58.0,399.0,393.0,385.0,,3.0
24Q530,INTERNATIONAL HIGH SCHOOL AT LAGUARDIA COMMUNITY COLLEGE,855084,69.0,326.0,409.0,329.0,92.0,4.0
24Q550,HIGH SCHOOL FOR ARTS AND BUSINESS,501780,138.0,391.0,403.0,380.0,92.0,2.0
24Q560,"ROBERT F. WAGNER, JR. SECONDARY SCHOOL FOR ARTS AND TECHNOLOGY",702975,80.0,443.0,447.0,440.0,,
24Q600,QUEENS VOCATIONAL AND TECHNICAL HIGH SCHOOL,683431,155.0,417.0,447.0,406.0,,4.0
24Q610,AVIATION CAREER & TECHNICAL EDUCATION HIGH SCHOOL,777331,396.0,445.0,496.0,423.0,92.0,3.0
25Q252,"QUEENS SCHOOL OF INQUIRY, THE",333672,58.0,455.0,498.0,443.0,78.0,3.0
25Q263,FLUSHING INTERNATIONAL HIGH SCHOOL,416654,45.0,314.0,417.0,318.0,,1.0
25Q281,EASTsWEST SCHOOL OF INTERNATIONAL STUDIES,208611,59.0,416.0,463.0,392.0,,1.0
25Q285,WORLD JOURNALISM PREPARATORY: A COLLEGE BOARD SCHOOL,900895,63.0,471.0,489.0,481.0,,3.0
25Q425,JOHN BOWNE HIGH SCHOOL,636437,558.0,397.0,451.0,395.0,78.0,2.0
25Q460,FLUSHING HIGH SCHOOL,141602,347.0,393.0,441.0,382.0,85.0,1.0
25Q467,FLUSHING YABC,223328,9.0,378.0,373.0,344.0,78.0,4.0
25Q525,TOWNSEND HARRIS HIGH SCHOOL,362526,278.0,621.0,651.0,638.0,78.0,1.0
25Q540,QUEENS ACADEMY HIGH SCHOOL,661632,17.0,398.0,382.0,388.0,,2.0
25Q670,ROBERT F. KENNEDY COMMUNITY HIGH SCHOOL,591892,99.0,431.0,458.0,441.0,92.0,2.0
25Q792,NORTH QUEENS COMMUNITY HIGH SCHOOL,847586,7.0,379.0,421.0,377.0,78.0,1.0
26Q415,BENJAMIN N. CARDOZO HIGH SCHOOL,375591,888.0,480.0,545.0,489.0,78.0,4.0
26Q430,FRANCIS LEWIS HIGH SCHOOL,148605,934.0,468.0,539.0,467.0,,1.0
26Q435,MARTIN VAN BUREN HIGH SCHOOL,152888,334.0,391.0,397.0,384.0,78.0,3.0
26Q495,BAYSIDE HIGH SCHOOL,584531,708.0,462.0,523.0,464.0,,4.0
26Q566,"QUEENS HIGH SCHOOL OF TEACHING, LIBERAL ARTS AND THE SCIENCES",150229,175.0,425.0,434.0,420.0,85.0,4.0
27Q260,FREDERICK DOUGLASS ACADEMY VI HIGH SCHOOL,216311,87.0,387.0,385.0,373.0,85.0,3.0
27Q262,CHANNEL VIEW SCHOOL FOR RESEARCH,968929,74.0,432.0,419.0,401.0,78.0,2.0
27Q302,"QUEENS HIGH SCHOOL FOR INFORMATION, RESEARCH, AND TECHNOLOGY",292533,44.0,391.0,401.0,364.0,85.0,4.0
27Q308,ROBERT H. GODDARD HIGH SCHOOL OF COMMUNICATION ARTS AND TECHNOLOGY,676177,93.0,423.0,426.0,416.0,,4.0
27Q309,ACADEMY OF MEDICAL TECHNOLOGY: A COLLEGE BOARD SCHOOL,933051,36.0,367.0,379.0,348.0,92.0,
27Q323,SCHOLARS' ACADEMY,291769,89.0,499.0,537.0,496.0,78.0,3.0
27Q400,AUGUST MARTIN HIGH SCHOOL,691098,101.0,377.0,371.0,360.0,78.0,4.0
27Q410,BEACH CHANNEL HIGH SCHOOL,503694,78.0,384.0,396.0,354.0,,1.0
27Q475,RICHMOND HILL HIGH SCHOOL,156250,404.0,382.0,404.0,368.0,78.0,4.0
27Q480,JOHN ADAMS HIGH SCHOOL,863765,403.0,391.0,409.0,392.0,92.0,1.0
27Q650,"HIGH SCHOOL FOR CONSTRUCTION TRADES, ENGINEERING AND ARCHITECTURE",776444,194.0,429.0,491.0,425.0,85.0,3.0
28Q310,QUEENS COLLEGIATE: A COLLEGE BOARD SCHOOL,880835,68.0,420.0,445.0,400.0,78.0,4.0
28Q338,QUEENS SATELLITE HIGH SCHOOL FOR OPPORTUNITY,553915,6.0,403.0,408.0,367.0,92.0,4.0
28Q350,JAMAICA GATEWAY TO THE SCIENCES,904223,25.0,430.0,452.0,425.0,78.0,2.0
28Q440,FOREST HILLS HIGH SCHOOL,597825,762.0,456.0,497.0,454.0,78.0,1.0
28Q470,JAMAICA HIGH SCHOOL,587904,90.0,342.0,,353.0,92.0,3.0
28Q505,HILLCREST HIGH SCHOOL,317746,462.0,395.0,413.0,386.0,85.0,2.0
28Q620,THOMAS A. EDISON CAREER AND TECHNICAL EDUCATION HIGH SCHOOL,353160,422.0,452.0,478.0,442.0,85.0,2.0
28Q680,QUEENS GATEWAY TO HEALTH SCIENCES SECONDARY SCHOOL,745665,99.0,513.0,523.0,502.0,85.0,1.0
28Q687,QUEENS HIGH SCHOOL FOR THE SCIENCES AT YORK COLLEGE,936593,121.0,612.0,660.0,596.0,92.0,2.0
28Q690,HIGH SCHOOL FOR LAW ENFORCEMENT AND PUBLIC SAFETY,216035,74.0,406.0,406.0,384.0,,4.0
28Q896,"YOUNG WOMEN'S LEADERSHIP SCHOOL, QUEENS",597664,68.0,439.0,445.0,432.0,92.0,1.0
29Q248,QUEENS PREPARATORY ACADEMY,505363,52.0,360.0,380.0,359.0,85.0,
29Q259,PATHWAYS COLLEGE PREPARATORY SCHOOL: A COLLEGE BOARD SCHOOL,231477,46.0,401.0,397.0,375.0,92.0,1.0
29Q265,EXCELSIOR PREPARATORY HIGH SCHOOL,268657,49.0,402.0,398.0,402.0,85.0,
29Q272,GEORGE WASHINGTON CARVER HIGH SCHOOL FOR THE SCIENCES,458826,59.0,436.0,427.0,424.0,92.0,2.0
29Q283,PREPARATORY ACADEMY FOR WRITERS: A COLLEGE BOARD SCHOOL,462173,43.0,370.0,,363.0,85.0,3.0
29Q492,"MATHEMATICS, SCIENCE RESEARCH AND TECHNOLOGY MAGNET HIGH SCHOOL",790855,78.0,400.0,426.0,394.0,92.0,
29Q494,"LAW, GOVERNMENT AND COMMUNITY SERVICE HIGH SCHOOL",245490,52.0,385.0,377.0,377.0,85.0,
29Q496,"BUSINESS, COMPUTER APPLICATIONS & ENTREPRENEURSHIP HIGH SCHOOL",455709,49.0,379.0,414.0,359.0,,3.0
29Q498,HUMANITIES & ARTS MAGNET HIGH SCHOOL,341277,62.0,393.0,381.0,377.0,78.0,
30Q301,ACADEMY FOR CAREERS IN TELEVISION AND FILM,515061,98.0,410.0,440.0,405.0,78.0,4.0
30Q445,WILLIAM CULLEN BRYANT HIGH SCHOOL,894217,395.0,414.0,449.0,412.0,85.0,4.0
30Q450,LONG ISLAND CITY HIGH SCHOOL,352878,392.0,403.0,420.0,395.0,92.0,3.0
30Q501,FRANK SINATRA SCHOOL OF THE ARTS HIGH SCHOOL,794171,174.0,504.0,496.0,494.0,92.0,2.0
30Q502,INFORMATION TECHNOLOGY HIGH SCHOOL,730551,148.0,407.0,434.0,398.0,,4.0
30Q555,NEWCOMERS HIGH SCHOOL,305938,143.0,323.0,475.0,329.0,78.0,2.0
30Q575,ACADEMY OF AMERICAN STUDIES,180221,135.0,487.0,492.0,491.0,,4.0
30Q580,BACCALAUREATE SCHOOL FOR GLOBAL EDUCATION,595723,61.0,524.0,568.0,544.0,78.0,3.0
31R047,CSI HIGH SCHOOL FOR INTERNATIONAL STUDIES,654645,137.0,452.0,451.0,450.0,92.0,4.0
31R064,GAYNOR MCCOWN EXPEDITIONARY LEARNING SCHOOL,140691,61.0,398.0,412.0,385.0,92.0,1.0
31R080,THE MICHAEL J. PETRIDES SCHOOL,844244,107.0,472.0,488.0,466.0,,1.0
31R440,NEW DORP HIGH SCHOOL,909567,391.0,424.0,437.0,416.0,92.0,1.0
31R445,PORT RICHMOND HIGH SCHOOL,145678,271.0,424.0,438.0,417.0,,3.0
31R450,CURTIS HIGH SCHOOL,315495,375.0,437.0,435.0,429.0,92.0,4.0
31R455,TOTTENVILLE HIGH SCHOOL,308512,807.0,462.0,486.0,470.0,92.0,
31R460,SUSAN E. WAGNER HIGH SCHOOL,240660,535.0,455.0,474.0,459.0,,2.0
31R470,CONCORD HIGH SCHOOL,974386,10.0,466.0,455.0,414.0,,3.0
31R600,RALPH R. MCKEE CAREER AND TECHNICAL EDUCATION HIGH SCHOOL,730239,94.0,416.0,422.0,397.0,85.0,3.0
31R605,STATEN ISLAND TECHNICAL HIGH SCHOOL,739097,227.0,635.0,682.0,636.0,,2.0
31R607,YOUNG ADULT BOROUGH CENTER AT STATEN IS TECH HS,653176,10.0,405.0,375.0,370.0,78.0,1.0
32K403,ACADEMY FOR ENVIRONMENTAL LEADERSHIP,501650,50.0,380.0,366.0,352.0,92.0,
32K545,EBC HIGH SCHOOL FOR PUBLIC SERVICE–BUSHWICK,221431,88.0,384.0,409.0,361.0,85.0,3.0
32K549,BUSHWICK SCHOOL FOR SOCIAL JUSTICE,954491,75.0,348.0,353.0,334.0,85.0,3.0
32K552,ACADEMY OF URBAN PLANNING,695572,67.0,342.0,364.0,354.0,92.0,3.0
32K554,ALL CITY LEADERSHIP SECONDARY SCHOOL,587220,39.0,428.0,465.0,422.0,,2.0
32K556,BUSHWICK LEADERS HIGH SCHOOL FOR ACADEMIC EXCELLENCE,658210,23.0,347.0,358.0,350.0,92.0,2.0
32K564,BUSHWICK COMMUNITY HIGH SCHOOL,898918,24.0,359.0,317.0,358.0,92.0,4.0
75Q811,P.S. Q811,467937,32.0,429.0,444.0,433.0,78.0,1.0
79Q950,GED PLUS s CITYWIDE,544514,8.0,496.0,400.0,426.0,92.0,2.0
79X490,PHOENIX ACADEMY,248647,9.0,367.0,370.0,360.0,85.0,
